{
  "slug": "europe-aerogel-suppliers",
  "title": "Europe Aerogel Suppliers: A Buyer Guide to Regional Producers, Distributors, and Research Channels",
  "date": "Fri, 17 Apr 2026 10:35:13 +0000",
  "content": "<p>Europe is an important aerogel sourcing region because it combines advanced materials research, industrial insulation demand, and a broad network of technical distributors. Searchers looking for <em>Europe aerogel suppliers</em> often need a practical way to compare regional producers, import channels, and sector-specific supply options.</p>\n<h2>Why Europe matters in aerogel sourcing</h2>\n<p>European buyers frequently evaluate performance, compliance, documentation quality, and application support alongside price. That makes supplier credibility especially important in this region.</p>\n<h2>How to evaluate European supplier options</h2>\n<ul><li>Check whether the supplier serves industrial, building, energy, or research markets</li><li>Review documentation quality and application specificity</li><li>Consider whether the supplier is a manufacturer or a regional distributor</li><li>Compare market coverage across multiple European countries</li></ul>\n<h2>FAQ</h2>\n<h3>Why is Europe a useful target for aerogel supplier searches?</h3><p>Because Europe combines advanced materials demand, distribution reach, and technical procurement standards across multiple countries.</p>\n<h3>Are European aerogel suppliers all based in one country?</h3><p>No. Supply may come from local producers, multi-country distributors, or imports supported by regional partners.</p>\n<h3>What should buyers check first?</h3><p>Supplier role, technical documentation, and evidence of service in the relevant end-use sector.</p>\n<h2>Related resources on Aerogela</h2>\n<ul>\n  <li><a href=\"https://aerogela.com/listing-category/aerogel-producers/\">Aerogel Producers</a></li>\n  <li><a href=\"https://aerogela.com/listing-category/distributors/\">Aerogel Distributors</a></li>\n  <li><a href=\"https://aerogela.com/what-is-aerogel-insulation/\">What Is Aerogel Insulation?</a></li>\n  <li><a href=\"https://aerogela.com/how-to-choose-aerogel-suppliers/\">How to Choose Aerogel Suppliers</a></li>\n  <li><a href=\"https://aerogela.com/blog/\">Aerogela Blog</a></li>\n</ul>",
  "excerpt": "",
  "hero": ""
}