{
  "slug": "aerogel-blanket-installation-guide",
  "title": "Aerogel Blanket Installation: What Contractors and Specifiers Need to Consider Before Ordering",
  "date": "Fri, 17 Apr 2026 09:43:51 +0000",
  "content": "<p>Many aerogel content searches happen late in the buying journey. When people search <em>aerogel blanket installation</em>, they are often past the awareness stage and already thinking about field execution. That makes installation-focused content particularly valuable for qualified B2B traffic.</p>\n<h2>Why installation matters as much as product data</h2>\n<p>An insulation product can look excellent on paper and still fail to deliver expected project value if installation is difficult, wasteful, or poorly supported. Blanket-format aerogel is attractive partly because it is flexible and easier to integrate around curved or congested surfaces.</p>\n<h2>Key installation considerations</h2>\n<ul><li>Thickness planning and layer build-up</li><li>Handling around valves, elbows, and irregular geometry</li><li>Compatibility with cladding and weather protection systems</li><li>Training or field guidance from the supplier</li><li>Waste reduction and cutting efficiency</li></ul>\n<h2>Why buyers should ask for application support</h2>\n<p>Installation guidance, not just product brochures, is a strong indicator of supplier maturity. Companies that can support field use usually communicate more clearly about limitations, best practices, and specification fit.</p>\n<h2>FAQ</h2>\n<h3>Is aerogel blanket difficult to install?</h3>\n<p>It can be easier than rigid alternatives in complex layouts, but good planning and supplier guidance still matter.</p>\n<h3>What should specifiers confirm before ordering?</h3>\n<p>Thickness, service conditions, cladding compatibility, and the supplier's field-support capability.</p>\n<h3>Why is this a strong SEO topic?</h3>\n<p>Because installation-focused searches usually indicate serious buying intent rather than casual interest.</p>\n<h2>Related resources on Aerogela</h2>\n<ul>\n  <li><a href=\"https://aerogela.com/what-is-aerogel-insulation/\">What Is Aerogel Insulation?</a></li>\n  <li><a href=\"https://aerogela.com/how-to-choose-aerogel-suppliers/\">How to Choose Aerogel Suppliers</a></li>\n  <li><a href=\"https://aerogela.com/aerogel-blanket-applications/\">Aerogel Blanket Applications</a></li>\n  <li><a href=\"https://aerogela.com/listing-category/aerogel-producers/\">Aerogel Producers Directory</a></li>\n  <li><a href=\"https://aerogela.com/listing-category/distributors/\">Aerogel Distributors Directory</a></li>\n</ul>",
  "excerpt": "",
  "hero": ""
}