{
  "slug": "usa-aerogel-suppliers",
  "title": "USA Aerogel Suppliers: Manufacturers, Distributors, and How B2B Buyers Should Compare Them",
  "date": "Fri, 17 Apr 2026 10:35:12 +0000",
  "content": "<p>The United States remains a high-value market for advanced insulation, industrial thermal systems, and specialty materials. Buyers searching <em>USA aerogel suppliers</em> are often trying to compare domestic manufacturers, regional distributors, and technically credible sourcing channels for North American projects.</p>\n<h2>What makes the US market important</h2>\n<p>The US has strong demand in industrial insulation, energy, building retrofit, aerospace, battery technologies, and engineering-led procurement. That makes supplier quality, documentation, and application support especially important.</p>\n<h2>How to compare US-based supply options</h2>\n<ul><li>Determine whether the company is a manufacturer, distributor, or systems provider</li><li>Check for industrial application evidence and product documentation</li><li>Compare regional support, lead times, and project-scale logistics</li><li>Review whether the supplier serves insulation, thermal management, or research markets</li></ul>\n<h2>FAQ</h2>\n<h3>Why would a buyer prefer a US aerogel supplier?</h3><p>For some projects, regional support, shorter logistics chains, and technical communication can be commercially important.</p>\n<h3>Are all US aerogel suppliers manufacturers?</h3><p>No. Some are distributors or application-focused solution providers rather than direct producers.</p>\n<h3>What should North American buyers compare first?</h3><p>Supplier type, technical documentation, application fit, and regional support capability.</p>\n<h2>Related resources on Aerogela</h2>\n<ul>\n  <li><a href=\"https://aerogela.com/listing-category/aerogel-producers/\">Aerogel Producers</a></li>\n  <li><a href=\"https://aerogela.com/listing-category/distributors/\">Aerogel Distributors</a></li>\n  <li><a href=\"https://aerogela.com/what-is-aerogel-insulation/\">What Is Aerogel Insulation?</a></li>\n  <li><a href=\"https://aerogela.com/how-to-choose-aerogel-suppliers/\">How to Choose Aerogel Suppliers</a></li>\n  <li><a href=\"https://aerogela.com/blog/\">Aerogela Blog</a></li>\n</ul>",
  "excerpt": "",
  "hero": ""
}