{
  "slug": "how-to-choose-aerogel-suppliers",
  "title": "How to Choose Aerogel Suppliers: A Practical B2B Checklist for Engineers and Buyers",
  "date": "Fri, 17 Apr 2026 08:39:02 +0000",
  "content": "<p>Finding the right aerogel supplier is not the same as finding the cheapest insulation vendor. In many projects, aerogel is selected because the application is constrained, technically demanding, or commercially sensitive. That means supplier selection should go beyond basic marketing claims. Engineers and buyers need a practical evaluation framework.</p>\n\n<p>This guide explains how to compare <strong>aerogel suppliers</strong> for industrial insulation, thermal management, construction, and specialty materials sourcing. Whether you are searching for silica aerogel blanket, board products, particles, or battery thermal barrier materials, the same sourcing principles apply.</p>\n\n<h2>1. Confirm the supplier’s actual product focus</h2>\n<p>Start by identifying what the company really supplies. Some companies manufacture aerogel materials directly. Others are distributors, converters, or solution providers. That distinction matters for pricing, technical depth, customization, and lead time.</p>\n<p>A useful first step is reviewing the supplier landscape by category. Aerogela maintains separate pages for <a href=\"https://aerogela.com/listing-category/aerogel-producers/\">Aerogel Producers</a> and <a href=\"https://aerogela.com/listing-category/distributors/\">Distributors</a>, which can help buyers narrow the field.</p>\n\n<h2>2. Match the product format to the application</h2>\n<p>Aerogel is not one universal SKU. Buyers should verify whether the supplier offers the right format for the intended use case:</p>\n<ul>\n  <li>Aerogel blanket for industrial insulation and piping</li>\n  <li>Panels or boards for building and engineered assemblies</li>\n  <li>Powders or particles for additives and specialty formulations</li>\n  <li>Thermal barriers or composites for batteries and electronics</li>\n</ul>\n<p>If a supplier’s website is vague on product form, ask for a current data sheet and product family overview before moving forward.</p>\n\n<h2>3. Review technical data carefully</h2>\n<p>Conductivity claims alone are not enough. Good supplier evaluation includes:</p>\n<ul>\n  <li>Declared thermal conductivity with test conditions</li>\n  <li>Operating temperature range</li>\n  <li>Density, thickness range, and compression behavior</li>\n  <li>Hydrophobicity or moisture-resistance data</li>\n  <li>Fire, smoke, or other safety-related performance information where relevant</li>\n</ul>\n<p>Always ask how the values were measured and under which standards. A realistic, fully documented data package is more valuable than a headline number without context.</p>\n\n<h2>4. Look for application evidence, not just product claims</h2>\n<p>Strong suppliers usually provide evidence that they understand real end-use conditions. This may include case studies, insulation design notes, application engineering support, installation guidance, or sector-specific references. A supplier that can explain how its material behaves in an actual process line, facade assembly, or battery system is usually more useful than one that only posts broad promotional language.</p>\n\n<h2>5. Assess supply reliability and geography</h2>\n<p>For industrial buyers, supply chain reliability is often decisive. Questions worth asking include:</p>\n<ul>\n  <li>Where are the products manufactured?</li>\n  <li>What are standard lead times?</li>\n  <li>Which regions are actively served?</li>\n  <li>Can the supplier support pilot quantities and later scale-up?</li>\n  <li>Is there local technical or distributor support?</li>\n</ul>\n<p>This is especially important for multi-site or EPC-managed projects where schedule certainty matters.</p>\n\n<h2>6. Ask about certifications and documentation</h2>\n<p>Depending on the industry, documentation requirements may include SDS files, technical data sheets, quality certifications, compliance declarations, or test reports. Serious suppliers generally make core documents available early in the sales cycle. If documentation is difficult to obtain, that can be a useful signal in itself.</p>\n\n<h2>7. Consider total project value, not just unit price</h2>\n<p>Aerogel products may carry a higher material price than commodity insulation. However, the commercial decision should consider installation thickness, labor implications, transport weight, access constraints, service performance, and maintenance impact. In some projects, the lower-thickness solution creates meaningful lifecycle or system-level value.</p>\n\n<h2>8. Build a shortlisting checklist</h2>\n<p>Before requesting quotations, buyers can use this shortlist framework:</p>\n<ul>\n  <li>Supplier type: producer or distributor</li>\n  <li>Product format matches project need</li>\n  <li>Published data sheets available</li>\n  <li>Relevant technical and compliance documentation available</li>\n  <li>Application references or engineering support evident</li>\n  <li>Regional supply and lead time acceptable</li>\n  <li>Commercial communication responsive and technically credible</li>\n</ul>\n\n<h2>FAQ: choosing aerogel suppliers</h2>\n<h3>What is the difference between an aerogel producer and an aerogel distributor?</h3>\n<p>A producer manufactures the aerogel material or finished product, while a distributor typically resells or represents products within a market or region.</p>\n\n<h3>Should buyers prioritize the lowest thermal conductivity?</h3>\n<p>Not automatically. Buyers should evaluate conductivity together with temperature range, installability, safety, durability, documentation, and supply reliability.</p>\n\n<h3>Where can I find aerogel suppliers to compare?</h3>\n<p>You can start with a structured industry directory such as <a href=\"https://aerogela.com/listings/\">Aerogela’s listings</a>, then compare the suppliers’ official websites, product documents, and technical positioning.</p>\n\n<h2>Final thoughts</h2>\n<p>Choosing aerogel suppliers is a sourcing exercise that blends materials science, engineering judgment, and procurement discipline. The best supplier is not simply the one with the boldest product claims. It is the one that can document performance, support the target application, and deliver reliably for the scale and region your project demands.</p>",
  "excerpt": "",
  "hero": ""
}