{
  "slug": "japan-aerogel-manufacturers",
  "title": "Japan Aerogel Manufacturers and Suppliers: Why the Market Matters for Advanced Materials and Thermal Design",
  "date": "Fri, 17 Apr 2026 10:35:14 +0000",
  "content": "<p>Japan is widely associated with advanced materials, precision manufacturing, and engineering-intensive product development. That makes <em>Japan aerogel manufacturers</em> and suppliers a meaningful long-tail search topic for buyers looking beyond generic supplier lists.</p>\n<h2>Why Japan is relevant in aerogel discussions</h2>\n<p>Japanese industry is often linked to high-specification materials, electronics, industrial systems, and disciplined manufacturing processes. Buyers searching this topic often expect strong technical positioning rather than mass-market trading language.</p>\n<h2>What to check when evaluating Japanese aerogel suppliers</h2>\n<ul><li>Technical application focus</li><li>Manufacturing or R&D credibility</li><li>Availability of English-language documentation where needed</li><li>Fit for specialty thermal-management or industrial use cases</li></ul>\n<h2>FAQ</h2>\n<h3>Why do buyers search for Japan aerogel manufacturers?</h3><p>Because Japan is associated with high-specification materials, advanced engineering, and technical manufacturing credibility.</p>\n<h3>Are Japanese aerogel suppliers always export-focused?</h3><p>No. Some may be domestically oriented or focused on specialized applications rather than broad export channels.</p>\n<h3>What should international buyers verify first?</h3><p>Product availability, documentation access, and whether the supplier's application focus matches the project need.</p>\n<h2>Related resources on Aerogela</h2>\n<ul>\n  <li><a href=\"https://aerogela.com/listing-category/aerogel-producers/\">Aerogel Producers</a></li>\n  <li><a href=\"https://aerogela.com/listing-category/distributors/\">Aerogel Distributors</a></li>\n  <li><a href=\"https://aerogela.com/what-is-aerogel-insulation/\">What Is Aerogel Insulation?</a></li>\n  <li><a href=\"https://aerogela.com/how-to-choose-aerogel-suppliers/\">How to Choose Aerogel Suppliers</a></li>\n  <li><a href=\"https://aerogela.com/blog/\">Aerogela Blog</a></li>\n</ul>",
  "excerpt": "",
  "hero": "/heroes/japan-aerogel-manufacturers"
}
