{
  "slug": "aerogel-insulation-cui-risk",
  "title": "Aerogel Insulation and CUI Risk: Why Hydrophobic Materials Matter in Industrial Systems",
  "date": "Fri, 17 Apr 2026 08:41:30 +0000",
  "content": "<p>Corrosion under insulation, commonly called CUI, is a major lifecycle concern in industrial facilities. Whenever insulated piping and equipment are exposed to moisture ingress, the hidden corrosion risk can create safety, maintenance, and cost problems. This is one reason buyers increasingly search for information about <em>aerogel insulation and CUI</em>, especially in process industries, refining, and offshore environments.</p>\n<h2>Why CUI matters</h2>\n<p>CUI is difficult because it often develops beneath the insulation system where direct visual inspection is limited. Material choice alone does not eliminate the problem, but insulation design, moisture behavior, cladding quality, maintenance strategy, and operating conditions all influence risk.</p>\n<h2>Why aerogel enters the discussion</h2>\n<p>Some aerogel insulation products are promoted as hydrophobic or moisture-resistant, which is relevant in CUI conversations. In practical terms, buyers want to know whether the insulation system can reduce water retention, support faster drying, or otherwise fit a lower-risk insulation strategy. These are application-specific questions, so public claims should always be checked against product documentation.</p>\n<h2>What to evaluate in supplier documentation</h2>\n<ul><li>Hydrophobic performance claims and test methods</li><li>Service temperature range</li><li>System design recommendations for jacketing and sealing</li><li>Installation guidance and maintenance considerations</li><li>Industrial case references where available</li></ul>\n<h2>Aerogel is not a standalone CUI cure</h2>\n<p>It is important to avoid oversimplification. No insulation material alone guarantees zero CUI. Good engineering still requires proper weather barriers, installation quality, inspection planning, and corrosion management. However, hydrophobic aerogel blanket products are relevant because they may fit strategies aimed at reducing moisture-related performance concerns in challenging industrial settings.</p>\n<h2>Related supplier research</h2>\n<p>If your team is comparing industrial insulation suppliers, start with Aerogela’s <a href=\"https://aerogela.com/listing-category/aerogel-producers/\">Aerogel Producers</a> section, then check each company’s official technical literature for hydrophobicity and industrial service data.</p>\n<h2>FAQ</h2>\n<h3>Does aerogel eliminate CUI risk entirely?</h3><p>No. It may support a lower-risk system strategy, but design, cladding, and maintenance still matter.</p>\n<h3>Why is hydrophobic behavior important here?</h3><p>Because moisture management strongly affects insulation reliability and corrosion-related maintenance concerns.</p>\n<h3>What should buyers ask suppliers first?</h3><p>Ask for hydrophobicity data, system recommendations, and industrial-use documentation.</p>\n<h2>Related resources on Aerogela</h2>\n<ul>\n  <li><a href=\"https://aerogela.com/what-is-aerogel-insulation/\">What Is Aerogel Insulation?</a></li>\n  <li><a href=\"https://aerogela.com/how-to-choose-aerogel-suppliers/\">How to Choose Aerogel Suppliers</a></li>\n  <li><a href=\"https://aerogela.com/aerogel-blanket-applications/\">Aerogel Blanket Applications</a></li>\n  <li><a href=\"https://aerogela.com/listing-category/aerogel-producers/\">Aerogel Producers Directory</a></li>\n  <li><a href=\"https://aerogela.com/listing-category/distributors/\">Aerogel Distributors Directory</a></li>\n</ul>",
  "excerpt": "",
  "hero": ""
}