{
  "slug": "china-aerogel-manufacturers",
  "title": "China Aerogel Manufacturers: How to Identify Real Producers, Exporters, and Industrial Suppliers",
  "date": "Fri, 17 Apr 2026 10:35:12 +0000",
  "content": "<p>China is one of the most important regions in the global aerogel supply chain. Buyers searching <em>China aerogel manufacturers</em> are often looking for more than a company list. They want to know which firms are actual producers, which are trading companies, and which suppliers have credible industrial positioning in silica aerogel, aerogel blanket, and thermal insulation materials.</p>\n<h2>Why China matters in the aerogel market</h2>\n<p>China has strong activity across chemicals, insulation materials, silica technology, and advanced manufacturing. That industrial base makes it highly relevant for buyers sourcing aerogel materials, especially for insulation, industrial energy-saving applications, and export-oriented supply.</p>\n<h2>How to separate producers from non-producers</h2>\n<ul><li>Check whether the company presents manufacturing facilities on its official site</li><li>Look for product families rather than only trading language</li><li>Review whether the supplier publishes technical materials and application positioning</li><li>Confirm whether the company appears to serve industrial projects or only small resale channels</li></ul>\n<h2>Where to start your research</h2>\n<p>Aerogela already maintains a growing set of China-related aerogel company listings. Start with the <a href=\"https://aerogela.com/listing-category/aerogel-producers/\">Aerogel Producers</a> category, then compare official websites, product pages, and documented application focus.</p>\n<h2>FAQ</h2>\n<h3>Why do so many buyers search for China aerogel manufacturers?</h3><p>Because China has broad industrial capacity and a meaningful presence in aerogel-related materials and insulation supply.</p>\n<h3>How can I verify whether a Chinese aerogel company is a real manufacturer?</h3><p>Check for factory information, product documentation, application focus, and signs of direct production capability on the official website.</p>\n<h3>Is China mainly relevant for low-cost supply?</h3><p>No. It is also relevant for scale, industrial materials integration, and product availability across multiple aerogel-related segments.</p>\n<h2>Related resources on Aerogela</h2>\n<ul>\n  <li><a href=\"https://aerogela.com/listing-category/aerogel-producers/\">Aerogel Producers</a></li>\n  <li><a href=\"https://aerogela.com/listing-category/distributors/\">Aerogel Distributors</a></li>\n  <li><a href=\"https://aerogela.com/what-is-aerogel-insulation/\">What Is Aerogel Insulation?</a></li>\n  <li><a href=\"https://aerogela.com/how-to-choose-aerogel-suppliers/\">How to Choose Aerogel Suppliers</a></li>\n  <li><a href=\"https://aerogela.com/blog/\">Aerogela Blog</a></li>\n</ul>",
  "excerpt": "",
  "hero": "/heroes/china-aerogel-manufacturers"
}
