{
  "slug": "aerogel-insulation-for-industrial-pipes",
  "title": "Aerogel Insulation for Industrial Pipes: Why Thin, Flexible Blanket Systems Win in Tight Layouts",
  "date": "Fri, 17 Apr 2026 09:43:49 +0000",
  "content": "<p>Industrial piping systems are one of the clearest use cases for aerogel blanket materials. Search demand around <em>aerogel insulation for pipes</em> and <em>industrial pipe insulation</em> keeps growing because piping layouts are often dense, hot, difficult to access, and geometrically complex. These are exactly the conditions where thin, flexible insulation gains practical value.</p>\n<h2>Why pipes are a natural aerogel application</h2>\n<p>Pipes are rarely insulated in empty space. They sit beside supports, flanges, valves, cable trays, walls, and neighboring process lines. In this kind of layout, a thinner insulation build can improve access and reduce clashes while still supporting thermal performance goals.</p>\n<h2>What makes aerogel blanket suitable for piping</h2>\n<ul><li>Flexible installation around curved surfaces</li><li>Strong thermal performance in thin sections</li><li>Lower profile around congested pipe racks</li><li>Useful fit for retrofit and removable cover systems</li></ul>\n<h2>Where buyers should be cautious</h2>\n<p>Pipe insulation selection still depends on service temperature, mechanical protection, weather barrier design, and maintenance strategy. Buyers should not assume every aerogel blanket is interchangeable. Product documentation and application support remain essential.</p>\n<h2>How to source suppliers</h2>\n<p>Start with companies that clearly describe industrial insulation use cases, not only generic aerogel claims. Aerogela's <a href=\"https://aerogela.com/listing-category/aerogel-producers/\">Aerogel Producers</a> and <a href=\"https://aerogela.com/listing-category/distributors/\">Distributors</a> directories provide a structured starting point.</p>\n<h2>FAQ</h2>\n<h3>Why is aerogel useful on industrial pipes?</h3>\n<p>Because pipes often run through tight spaces where insulation thickness directly affects access and installation.</p>\n<h3>Is aerogel only for high-temperature piping?</h3>\n<p>No. Suitability depends on the specific product and service conditions, including low-temperature systems in some cases.</p>\n<h3>What should buyers compare first?</h3>\n<p>Thermal data, thickness options, installation practicality, and supplier support for pipe insulation systems.</p>\n<h2>Related resources on Aerogela</h2>\n<ul>\n  <li><a href=\"https://aerogela.com/what-is-aerogel-insulation/\">What Is Aerogel Insulation?</a></li>\n  <li><a href=\"https://aerogela.com/how-to-choose-aerogel-suppliers/\">How to Choose Aerogel Suppliers</a></li>\n  <li><a href=\"https://aerogela.com/aerogel-blanket-applications/\">Aerogel Blanket Applications</a></li>\n  <li><a href=\"https://aerogela.com/listing-category/aerogel-producers/\">Aerogel Producers Directory</a></li>\n  <li><a href=\"https://aerogela.com/listing-category/distributors/\">Aerogel Distributors Directory</a></li>\n</ul>",
  "excerpt": "",
  "hero": ""
}