{
  "slug": "uk-aerogel-suppliers",
  "title": "UK Aerogel Suppliers: Where Engineers, Contractors, and Buyers Look for High-Performance Insulation",
  "date": "Fri, 17 Apr 2026 10:35:14 +0000",
  "content": "<p>The UK market is highly relevant for aerogel searches tied to retrofit, construction, industrial insulation, and technical distribution. People looking for <em>UK aerogel suppliers</em> usually want to know which companies can provide reliable product access, technical communication, and credible application support.</p>\n<h2>Why the UK is a useful aerogel sourcing market</h2>\n<p>The UK combines specialist distributors, engineering buyers, construction retrofit demand, and industrial maintenance markets. That makes it a practical region for both direct product sourcing and distributor-led procurement.</p>\n<h2>How to assess UK suppliers</h2>\n<ul><li>Check whether the supplier actually stocks or represents aerogel products</li><li>Review whether the company serves building, industrial, or technical materials markets</li><li>Evaluate support for specification, purchasing, and contractor workflows</li></ul>\n<h2>FAQ</h2>\n<h3>Why is the UK important for aerogel distribution?</h3><p>Because it combines construction retrofit interest, industrial insulation demand, and strong distributor-led procurement channels.</p>\n<h3>What should contractors look for first?</h3><p>Availability, technical support, and whether the supplier aligns with the target application.</p>\n<h3>Can UK suppliers serve projects outside the UK?</h3><p>Some can, especially those operating through broader European or international distribution networks.</p>\n<h2>Related resources on Aerogela</h2>\n<ul>\n  <li><a href=\"https://aerogela.com/listing-category/aerogel-producers/\">Aerogel Producers</a></li>\n  <li><a href=\"https://aerogela.com/listing-category/distributors/\">Aerogel Distributors</a></li>\n  <li><a href=\"https://aerogela.com/what-is-aerogel-insulation/\">What Is Aerogel Insulation?</a></li>\n  <li><a href=\"https://aerogela.com/how-to-choose-aerogel-suppliers/\">How to Choose Aerogel Suppliers</a></li>\n  <li><a href=\"https://aerogela.com/blog/\">Aerogela Blog</a></li>\n</ul>",
  "excerpt": "",
  "hero": "/heroes/uk-aerogel-suppliers"
}
