{
  "slug": "aerogel-cold-chain-insulation",
  "title": "Aerogel for Cold Chain Insulation: High-Performance Thermal Control Beyond Traditional Materials",
  "date": "Fri, 17 Apr 2026 09:43:52 +0000",
  "content": "<p>Cold chain performance depends on stable temperature control across storage, handling, and transport. As demand for energy-efficient refrigerated systems grows, more buyers are exploring <em>aerogel for cold chain insulation</em> as part of the broader search for thin, high-performance thermal materials.</p>\n<h2>Why cold chain applications create interest in aerogel</h2>\n<p>Cold chain equipment often benefits from insulation systems that preserve payload space, reduce heat gain, and fit compact equipment geometries. That makes aerogel relevant in cases where conventional thickness becomes a design limitation.</p>\n<h2>Typical use cases under consideration</h2>\n<ul><li>Refrigerated containers and mobile systems</li><li>Specialty cold storage assemblies</li><li>Compact low-temperature equipment</li><li>Systems where internal usable volume is commercially important</li></ul>\n<h2>What buyers should compare</h2>\n<p>Thermal performance, cost justification, durability, installation approach, and whether the supplier actually targets low-temperature logistics or adjacent insulation markets.</p>\n<h2>FAQ</h2>\n<h3>Is aerogel common in all cold chain systems?</h3>\n<p>No. It is usually evaluated when insulation thickness and thermal efficiency are both commercially important.</p>\n<h3>Why would cold chain buyers consider aerogel?</h3>\n<p>Because preserving internal space while controlling heat gain can create real operational value.</p>\n<h3>How can I identify suppliers?</h3>\n<p>Use Aerogela's listings to identify aerogel companies, then review each supplier's technical positioning for low-temperature applications.</p>\n<h2>Related resources on Aerogela</h2>\n<ul>\n  <li><a href=\"https://aerogela.com/what-is-aerogel-insulation/\">What Is Aerogel Insulation?</a></li>\n  <li><a href=\"https://aerogela.com/how-to-choose-aerogel-suppliers/\">How to Choose Aerogel Suppliers</a></li>\n  <li><a href=\"https://aerogela.com/aerogel-blanket-applications/\">Aerogel Blanket Applications</a></li>\n  <li><a href=\"https://aerogela.com/listing-category/aerogel-producers/\">Aerogel Producers Directory</a></li>\n  <li><a href=\"https://aerogela.com/listing-category/distributors/\">Aerogel Distributors Directory</a></li>\n</ul>",
  "excerpt": "",
  "hero": ""
}