{
  "slug": "silica-aerogel-vs-mineral-wool-vs-pir",
  "title": "Silica Aerogel vs Mineral Wool vs PIR: Which Insulation Works Better in Tight Spaces?",
  "date": "Fri, 17 Apr 2026 08:39:02 +0000",
  "content": "<p>When project teams compare advanced insulation materials, one of the most common questions is whether <strong>silica aerogel</strong> is actually better than conventional options such as mineral wool or PIR. The honest answer is: it depends on the project constraint. No single material wins every decision. But when thickness is limited, silica aerogel often becomes much more competitive.</p>\n\n<p>This article offers a practical, SEO-focused comparison for readers searching terms like <em>silica aerogel vs mineral wool</em>, <em>aerogel vs PIR insulation</em>, and <em>high-performance thin insulation materials</em>.</p>\n\n<h2>The core difference: thermal performance per thickness</h2>\n<p>The main reason silica aerogel receives so much attention is that it can offer strong thermal performance in a relatively thin profile. In contrast, mineral wool and PIR are often selected because they are widely available, familiar to contractors, and cost-effective in many standard applications. When enough installation depth is available, conventional materials may be perfectly suitable. When depth is constrained, the economics can change.</p>\n\n<h2>Silica aerogel</h2>\n<p>Silica aerogel is best known for its highly porous nanostructure and very low thermal conductivity. Commercial products are frequently supplied as blankets or composite systems rather than brittle monolithic blocks. The value proposition is clear: reduce thickness while maintaining insulation performance.</p>\n<p><strong>Often favored when:</strong></p>\n<ul>\n  <li>Clearance is limited</li>\n  <li>Weight reduction matters</li>\n  <li>Retrofit conditions are difficult</li>\n  <li>Complex geometry needs flexible insulation</li>\n</ul>\n\n<h2>Mineral wool</h2>\n<p>Mineral wool is a widely used insulation material with strong familiarity in industrial and building markets. It is often cost-effective, easy to source, and suitable for many standard thermal and fire-related applications. However, achieving a target insulation value may require more thickness than an aerogel-based system.</p>\n<p><strong>Often favored when:</strong></p>\n<ul>\n  <li>Space is less constrained</li>\n  <li>Budgets are highly cost-sensitive</li>\n  <li>The project uses established conventional specifications</li>\n</ul>\n\n<h2>PIR insulation</h2>\n<p>PIR (polyisocyanurate) is common in building insulation and certain panel systems. It is often chosen for its favorable thermal performance relative to some traditional materials and its established role in construction assemblies. However, suitability depends heavily on the specific application, temperature range, code requirements, and system design.</p>\n<p><strong>Often favored when:</strong></p>\n<ul>\n  <li>The application is building-focused</li>\n  <li>Panelized or board-type insulation is preferred</li>\n  <li>Project specifications already align with PIR systems</li>\n</ul>\n\n<h2>Which insulation is better in tight spaces?</h2>\n<p>In very tight spaces, silica aerogel often stands out because the design problem is not simply insulation value; it is insulation value <em>within a strict thickness limit</em>. This is common in facade retrofits, industrial equipment enclosures, process lines with access constraints, and specialty thermal management components.</p>\n<p>If thickness is not a limiting factor, mineral wool or PIR may remain attractive because of availability and cost structure. But when every millimeter counts, aerogel is far more likely to justify detailed evaluation.</p>\n\n<h2>Other buying considerations</h2>\n<ul>\n  <li>Installation method and labor requirements</li>\n  <li>Mechanical robustness in actual service</li>\n  <li>Moisture exposure and environmental durability</li>\n  <li>Fire and compliance requirements</li>\n  <li>Availability of technical documentation and local supply</li>\n</ul>\n\n<h2>Where to compare suppliers</h2>\n<p>If your project calls for a thin high-performance insulation material, the next step is supplier comparison rather than theory alone. Aerogela helps users identify companies active in aerogel materials through its <a href=\"https://aerogela.com/listing-category/aerogel-producers/\">Aerogel Producers</a> directory and broader <a href=\"https://aerogela.com/listings/\">industry listings</a>.</p>\n\n<h2>FAQ: aerogel vs conventional insulation</h2>\n<h3>Is silica aerogel always better than mineral wool?</h3>\n<p>No. It is often more compelling when insulation thickness, weight, or geometry constraints are severe. Mineral wool remains appropriate for many standard applications.</p>\n\n<h3>Is PIR a direct substitute for aerogel?</h3>\n<p>Sometimes the materials may compete in broader thermal design decisions, but they are not interchangeable in every application. Project conditions and system requirements determine suitability.</p>\n\n<h3>Why do engineers consider aerogel for retrofit projects?</h3>\n<p>Because retrofit work often has tight dimensional constraints, and aerogel can help preserve usable space while still improving thermal performance.</p>\n\n<h2>Bottom line</h2>\n<p>The right comparison is not “Which insulation is best in general?” but “Which insulation best fits the project constraint?” Silica aerogel is strongest when tight spaces, difficult geometry, and high thermal performance all matter at the same time. That is why it keeps appearing in high-intent industrial and construction search queries—and why more buyers are actively comparing aerogel suppliers for next-generation insulation projects.</p>",
  "excerpt": "",
  "hero": ""
}