{
  "slug": "aerogel-insulation-price-factors",
  "title": "Aerogel Insulation Price: What Actually Drives Cost in Industrial and Commercial Projects?",
  "date": "Fri, 17 Apr 2026 09:43:49 +0000",
  "content": "<p>One of the most common commercial questions in the aerogel industry is simple: why is aerogel insulation expensive, and when is the cost justified? Buyers searching <em>aerogel insulation price</em> are usually comparing more than a material quote. They are trying to understand whether a thinner, higher-performance insulation system creates enough project value to offset a higher upfront cost.</p>\n<h2>Why aerogel insulation price is different from commodity insulation</h2>\n<p>Aerogel is usually chosen when project constraints are demanding. That means price should be evaluated in the context of thickness limits, operating temperature, labor access, geometry complexity, and lifecycle impact. Comparing aerogel directly against a low-cost commodity insulation by square-meter material price alone can be misleading.</p>\n<h2>Main factors that influence aerogel insulation cost</h2>\n<ul><li>Product format such as blanket, panel, particle, or engineered thermal barrier</li><li>Thickness and density specification</li><li>Application temperature range and performance requirements</li><li>Volume purchased and regional supply chain availability</li><li>Whether the source is a producer or distributor</li><li>Installation complexity in the real project environment</li></ul>\n<h2>When higher price can still make economic sense</h2>\n<p>Aerogel can become commercially attractive when thinner insulation reduces rework, preserves interior space, simplifies retrofit design, reduces weight, or lowers labor time around complex geometry. In industrial facilities, access and congestion sometimes matter enough that installed-system economics become more important than raw material price.</p>\n<h2>How buyers should compare quotes</h2>\n<p>Request full technical documentation, not just a price sheet. Compare conductivity data, temperature range, hydrophobic performance where relevant, installation method, logistics, and supplier support. Aerogela's <a href=\"https://aerogela.com/listings/\">supplier directory</a> can help teams identify credible aerogel producers and distributors before requesting quotations.</p>\n<h2>FAQ</h2>\n<h3>Is aerogel always more expensive than traditional insulation?</h3>\n<p>Usually the material cost is higher, but project-level value can improve when thickness, weight, or access constraints are severe.</p>\n<h3>What is the biggest driver of aerogel insulation price?</h3>\n<p>Product specification and application context. Format, thickness, temperature requirements, and order volume all matter.</p>\n<h3>How should I compare aerogel supplier quotes?</h3>\n<p>Compare both price and documentation quality, technical fit, lead time, and installation implications.</p>\n<h2>Related resources on Aerogela</h2>\n<ul>\n  <li><a href=\"https://aerogela.com/what-is-aerogel-insulation/\">What Is Aerogel Insulation?</a></li>\n  <li><a href=\"https://aerogela.com/how-to-choose-aerogel-suppliers/\">How to Choose Aerogel Suppliers</a></li>\n  <li><a href=\"https://aerogela.com/aerogel-blanket-applications/\">Aerogel Blanket Applications</a></li>\n  <li><a href=\"https://aerogela.com/listing-category/aerogel-producers/\">Aerogel Producers Directory</a></li>\n  <li><a href=\"https://aerogela.com/listing-category/distributors/\">Aerogel Distributors Directory</a></li>\n</ul>",
  "excerpt": "",
  "hero": "/heroes/aerogel-insulation-price-factors"
}
