{
  "slug": "hydrophobic-aerogel-insulation",
  "title": "Hydrophobic Aerogel Insulation: Why Water Resistance Matters in Real-World Industrial Use",
  "date": "Fri, 17 Apr 2026 09:43:50 +0000",
  "content": "<p>Hydrophobicity is one of the most commercially important performance themes in aerogel insulation. Buyers rarely search <em>hydrophobic aerogel</em> out of academic curiosity. They search it because moisture behavior affects thermal performance, maintenance planning, and long-term system reliability in real industrial installations.</p>\n<h2>Why hydrophobic performance matters</h2>\n<p>Moisture can undermine insulation systems through reduced thermal effectiveness, hidden degradation, and maintenance complications. In challenging environments, buyers want insulation materials that fit a more water-resistant design strategy.</p>\n<h2>How hydrophobic aerogel is usually evaluated</h2>\n<ul><li>Water repellency claims</li><li>Suitability for industrial weather exposure</li><li>Fit in corrosion-under-insulation risk discussions</li><li>Long-term behavior within the full insulation assembly</li></ul>\n<h2>Questions to ask suppliers</h2>\n<p>Ask for test methods, environmental guidance, installation recommendations, and case references. A serious supplier should be able to explain how the material is intended to perform in moisture-related service conditions.</p>\n<h2>FAQ</h2>\n<h3>Does hydrophobic aerogel eliminate all moisture-related risk?</h3>\n<p>No. It can be relevant to moisture management, but full system design and installation quality still matter.</p>\n<h3>Why is this topic important in industrial insulation?</h3>\n<p>Because moisture behavior is closely tied to lifecycle cost, reliability, and maintenance concerns.</p>\n<h3>Where can I compare suppliers?</h3>\n<p>Aerogela's supplier listings are a useful first step before requesting technical literature from individual companies.</p>\n<h2>Related resources on Aerogela</h2>\n<ul>\n  <li><a href=\"https://aerogela.com/what-is-aerogel-insulation/\">What Is Aerogel Insulation?</a></li>\n  <li><a href=\"https://aerogela.com/how-to-choose-aerogel-suppliers/\">How to Choose Aerogel Suppliers</a></li>\n  <li><a href=\"https://aerogela.com/aerogel-blanket-applications/\">Aerogel Blanket Applications</a></li>\n  <li><a href=\"https://aerogela.com/listing-category/aerogel-producers/\">Aerogel Producers Directory</a></li>\n  <li><a href=\"https://aerogela.com/listing-category/distributors/\">Aerogel Distributors Directory</a></li>\n</ul>",
  "excerpt": "",
  "hero": ""
}