{
  "slug": "germany-aerogel-suppliers",
  "title": "Germany Aerogel Suppliers: Industrial Insulation, Advanced Materials, and B2B Sourcing Signals",
  "date": "Fri, 17 Apr 2026 10:35:13 +0000",
  "content": "<p>Germany is one of the strongest industrial economies in Europe, so search demand around <em>Germany aerogel suppliers</em> is closely tied to engineering, manufacturing, energy efficiency, and technical materials procurement. Buyers are usually looking for serious B2B partners rather than commodity resellers.</p>\n<h2>Why Germany is relevant</h2>\n<p>Germany's industrial base makes it highly relevant for thermal insulation, specialty materials, industrial processing, and advanced manufacturing supply chains.</p>\n<h2>What buyers should verify</h2>\n<ul><li>Industrial market focus</li><li>Availability of technical data and compliance documentation</li><li>Whether the company acts as a producer, converter, or distributor</li><li>Support for project-scale procurement and engineering communication</li></ul>\n<h2>FAQ</h2>\n<h3>Why do buyers search specifically for Germany aerogel suppliers?</h3><p>Because Germany is associated with industrial quality, engineering-led procurement, and strong manufacturing demand.</p>\n<h3>What is the first thing to verify?</h3><p>Whether the company truly supplies aerogel-related products for the relevant industrial use case.</p>\n<h3>Are German suppliers only relevant to Germany?</h3><p>No. Many suppliers and distributors in Germany also support broader European markets.</p>\n<h2>Related resources on Aerogela</h2>\n<ul>\n  <li><a href=\"https://aerogela.com/listing-category/aerogel-producers/\">Aerogel Producers</a></li>\n  <li><a href=\"https://aerogela.com/listing-category/distributors/\">Aerogel Distributors</a></li>\n  <li><a href=\"https://aerogela.com/what-is-aerogel-insulation/\">What Is Aerogel Insulation?</a></li>\n  <li><a href=\"https://aerogela.com/how-to-choose-aerogel-suppliers/\">How to Choose Aerogel Suppliers</a></li>\n  <li><a href=\"https://aerogela.com/blog/\">Aerogela Blog</a></li>\n</ul>",
  "excerpt": "",
  "hero": ""
}