{
  "slug": "aerogel-fire-protection-applications",
  "title": "Aerogel Fire Protection Applications: Thermal Barriers, Passive Fire Protection, and Safety-Driven Design",
  "date": "Fri, 17 Apr 2026 09:43:50 +0000",
  "content": "<p>Aerogel is increasingly discussed in the context of fire safety because it can function as a compact thermal barrier in applications where heat resistance, limited space, and system safety all matter. Search phrases such as <em>aerogel fire protection</em> and <em>aerogel thermal barrier</em> often come from engineers evaluating materials for passive protection strategies rather than decorative insulation.</p>\n<h2>Why aerogel is relevant in fire-related design</h2>\n<p>In safety-critical systems, the engineering challenge is often to slow heat transfer while preserving packaging efficiency. Aerogel-based materials can become relevant when designers need a lightweight insulating layer within a limited envelope.</p>\n<h2>Typical use cases under evaluation</h2>\n<ul><li>Battery pack thermal barriers</li><li>Transportation safety assemblies</li><li>Industrial enclosures with heat shielding requirements</li><li>Specialty systems where passive thermal isolation is part of the design strategy</li></ul>\n<h2>Important sourcing considerations</h2>\n<p>Buyers should insist on application-specific data rather than broad marketing language. Fire-related selection requires careful review of testing conditions, compliance expectations, and full system integration.</p>\n<h2>FAQ</h2>\n<h3>Is aerogel itself a complete fire protection system?</h3>\n<p>Not necessarily. In most cases it is one material component within a larger safety-driven assembly or insulation system.</p>\n<h3>Why does aerogel matter in compact safety applications?</h3>\n<p>Because it can support thermal barrier performance without requiring excessive thickness.</p>\n<h3>What should engineers verify first?</h3>\n<p>Relevant test data, integration fit, and whether the supplier has real application experience in safety-critical environments.</p>\n<h2>Related resources on Aerogela</h2>\n<ul>\n  <li><a href=\"https://aerogela.com/what-is-aerogel-insulation/\">What Is Aerogel Insulation?</a></li>\n  <li><a href=\"https://aerogela.com/how-to-choose-aerogel-suppliers/\">How to Choose Aerogel Suppliers</a></li>\n  <li><a href=\"https://aerogela.com/aerogel-blanket-applications/\">Aerogel Blanket Applications</a></li>\n  <li><a href=\"https://aerogela.com/listing-category/aerogel-producers/\">Aerogel Producers Directory</a></li>\n  <li><a href=\"https://aerogela.com/listing-category/distributors/\">Aerogel Distributors Directory</a></li>\n</ul>",
  "excerpt": "",
  "hero": ""
}