{
  "slug": "aerogel-for-cryogenic-insulation",
  "title": "Aerogel for Cryogenic Insulation: LNG, Cold Storage, and Low-Temperature System Design",
  "date": "Fri, 17 Apr 2026 08:41:30 +0000",
  "content": "<p>Aerogel is often associated with high-performance industrial insulation, but it is also highly relevant in low-temperature and cryogenic discussions. Search interest around <em>aerogel for cryogenic insulation</em> continues to grow because LNG infrastructure, cold-chain systems, and low-temperature process equipment all demand careful control of heat transfer, thickness, and reliability.</p>\n<h2>Why cryogenic insulation is challenging</h2>\n<p>Cryogenic systems operate under conditions where heat ingress must be minimized and insulation design errors can become expensive very quickly. Storage tanks, transfer lines, valves, and associated equipment all need insulation strategies that support efficiency, frost control, and long-term performance.</p>\n<h2>Why aerogel is relevant</h2>\n<p>Aerogel-based insulation can be attractive in cryogenic contexts because it is associated with low thermal conductivity and compact insulation design. In systems where space, weight, or complex geometry matter, thinner high-performance insulation can offer practical engineering value.</p>\n<h2>Typical cryogenic and low-temperature use cases</h2>\n<ul><li>LNG and gas-processing infrastructure</li><li>Cold storage and specialty process equipment</li><li>Low-temperature industrial piping</li><li>Equipment with limited clearance for thick insulation systems</li></ul>\n<h2>Key evaluation criteria</h2>\n<ul><li>Thermal performance at relevant low-temperature conditions</li><li>Mechanical handling and installability</li><li>Moisture behavior in low-temperature environments</li><li>Compatibility with the broader insulation system design</li><li>Available case history and technical support</li></ul>\n<p>For buyer teams, the real task is not simply finding a product with a strong conductivity number. It is finding a supplier that can document low-temperature fit and support the required system design. Aerogela’s <a href=\"https://aerogela.com/listings/\">industry directory</a> can help narrow the search.</p>\n<h2>FAQ</h2>\n<h3>Is aerogel only used in high-temperature systems?</h3><p>No. It is also highly relevant in cryogenic and low-temperature insulation discussions.</p>\n<h3>Why does aerogel attract LNG-related interest?</h3><p>Because compact, high-performance insulation is valuable in demanding low-temperature infrastructure.</p>\n<h3>What should buyers verify?</h3><p>Low-temperature test context, system fit, and supplier support for cryogenic applications.</p>\n<h2>Related resources on Aerogela</h2>\n<ul>\n  <li><a href=\"https://aerogela.com/what-is-aerogel-insulation/\">What Is Aerogel Insulation?</a></li>\n  <li><a href=\"https://aerogela.com/how-to-choose-aerogel-suppliers/\">How to Choose Aerogel Suppliers</a></li>\n  <li><a href=\"https://aerogela.com/aerogel-blanket-applications/\">Aerogel Blanket Applications</a></li>\n  <li><a href=\"https://aerogela.com/listing-category/aerogel-producers/\">Aerogel Producers Directory</a></li>\n  <li><a href=\"https://aerogela.com/listing-category/distributors/\">Aerogel Distributors Directory</a></li>\n</ul>",
  "excerpt": "",
  "hero": ""
}