{
  "slug": "aerogel-blanket-applications",
  "title": "Aerogel Blanket Applications: Oil & Gas, EV Batteries, Construction, and Industrial Insulation",
  "date": "Fri, 17 Apr 2026 08:39:02 +0000",
  "content": "<p>Aerogel blanket is one of the most commercially important aerogel product formats on the market today. Search demand around <em>aerogel blanket applications</em> continues to rise because project teams want materials that combine thermal performance with installability. A blanket format is easier to wrap, cut, fit, and integrate into real industrial systems than many rigid alternatives.</p>\n\n<p>In this article, we look at the main application sectors where aerogel blanket products are most relevant and why buyers increasingly compare aerogel options when evaluating insulation upgrades.</p>\n\n<h2>What is an aerogel blanket?</h2>\n<p>An aerogel blanket is typically a flexible insulation composite made by integrating aerogel into a fibrous reinforcement matrix. The structure helps deliver low thermal conductivity while maintaining enough flexibility for practical handling and installation. This is especially useful for curved surfaces, removable insulation covers, and retrofit environments where geometry is irregular.</p>\n\n<h2>1. Oil and gas insulation</h2>\n<p>Oil and gas remains one of the best-known application areas for aerogel blanket insulation. Facilities often contain dense process layouts, long pipe runs, valves, vessels, and equipment requiring thermal control. When insulation thickness affects access, weight, or heat retention, aerogel blanket can become attractive.</p>\n<p>Common use cases include:</p>\n<ul>\n  <li>Hot process piping</li>\n  <li>Offshore modules where weight matters</li>\n  <li>Subsea or exposed environments depending on system design</li>\n  <li>LNG and cryogenic service in selected insulation architectures</li>\n</ul>\n\n<h2>2. Refining and petrochemical plants</h2>\n<p>Refineries and petrochemical sites often need insulation solutions that balance thermal performance, maintenance access, and long service life. Aerogel blanket may support thinner insulation builds in congested areas while helping reduce heat loss in process systems. Decision-makers usually compare it against mineral wool, calcium silicate, or other established products based on operating temperature, corrosion-under-insulation strategy, and installed system requirements.</p>\n\n<h2>3. Industrial insulation and removable covers</h2>\n<p>Aerogel blanket is frequently discussed for removable insulation pads, turbines, exhaust lines, steam systems, and compact industrial equipment. The blanket format is valuable because it can conform around flanges, valves, and custom housings. For maintenance teams, easier access and reinstallation can matter almost as much as thermal performance.</p>\n\n<h2>4. Building envelope and retrofit projects</h2>\n<p>In construction, aerogel blanket or aerogel-enhanced insulation systems are often evaluated for situations where space is limited. Historic building retrofits, high-value facades, thin wall assemblies, and specialty glazing-adjacent systems are common examples. In these cases, every millimeter matters. A thinner insulation layer can preserve interior space or simplify detailing where bulkier conventional materials create design conflicts.</p>\n\n<h2>5. EV battery and thermal management systems</h2>\n<p>Battery safety and thermal propagation control have pushed more attention toward advanced thermal materials. Aerogel-based barriers and composite formats are now frequently mentioned in EV battery pack discussions. While not every solution is literally a blanket product in the industrial-insulation sense, aerogel-derived flexible thermal barriers are relevant because they combine low conductivity with lightweight integration potential.</p>\n<p>For engineers, the important point is not hype but fit-for-purpose design. The right product depends on pack architecture, mechanical requirements, fire-test criteria, manufacturability, and cost targets.</p>\n\n<h2>6. Aerospace, rail, marine, and specialty transportation</h2>\n<p>Transportation sectors care deeply about weight, space, and safety. That makes aerogel blanket and aerogel composite materials interesting for specialty transportation applications ranging from rail systems to marine equipment and aerospace thermal protection concepts. Qualification requirements are strict, but the design logic is consistent: high thermal performance in constrained envelopes.</p>\n\n<h2>What makes aerogel blanket attractive across sectors?</h2>\n<ul>\n  <li>Thin insulation profiles for tight spaces</li>\n  <li>Reduced weight compared with some traditional systems</li>\n  <li>Flexibility for complex shapes and curved surfaces</li>\n  <li>Potential installation advantages in retrofit work</li>\n  <li>Strong interest in energy efficiency and thermal safety applications</li>\n</ul>\n\n<h2>Selection factors before specifying aerogel blanket</h2>\n<p>Not all aerogel blankets are identical. Before shortlisting a product or supplier, evaluate:</p>\n<ul>\n  <li>Target temperature range</li>\n  <li>Mechanical robustness and compressibility</li>\n  <li>Hydrophobic performance and environmental durability</li>\n  <li>Thickness options and installation method</li>\n  <li>Relevant certifications and application case history</li>\n  <li>Regional supply, lead time, and technical support</li>\n</ul>\n\n<p>If you are comparing supply options, Aerogela’s <a href=\"https://aerogela.com/listing-category/aerogel-producers/\">Aerogel Producers directory</a> is a useful starting point. Buyers looking for channel partners can also review the <a href=\"https://aerogela.com/listing-category/distributors/\">Distributors directory</a>.</p>\n\n<h2>FAQ: aerogel blanket applications</h2>\n<h3>What industries use aerogel blanket most often?</h3>\n<p>Industrial insulation, oil and gas, refining, construction retrofit, and advanced thermal management are among the most common discussion areas.</p>\n\n<h3>Why is aerogel blanket popular in retrofit projects?</h3>\n<p>Because it can offer strong insulation performance in thinner sections, which is valuable when existing structures leave little room for additional thickness.</p>\n\n<h3>Is aerogel blanket only for high-temperature systems?</h3>\n<p>No. Product suitability depends on the specific formulation and system design. Some applications focus on hot service, while others involve cryogenic or battery-related thermal control.</p>\n\n<h2>Conclusion</h2>\n<p>Aerogel blanket applications continue to expand because the format fits real-world installation needs. It is not simply a laboratory material; it is a practical insulation option for sectors where geometry, thickness, energy efficiency, and safety all matter. As more industries prioritize compact high-performance thermal systems, aerogel blanket will remain a high-intent search topic for engineers, buyers, and technical decision-makers.</p>",
  "excerpt": "",
  "hero": ""
}