{
  "slug": "south-korea-aerogel-suppliers",
  "title": "South Korea Aerogel Suppliers: Advanced Manufacturing, Energy Applications, and Supplier Research",
  "date": "Fri, 17 Apr 2026 10:35:14 +0000",
  "content": "<p>South Korea is an important advanced-manufacturing market, especially in energy systems, electronics, and industrial materials. Buyers searching <em>South Korea aerogel suppliers</em> are often interested in technical credibility, manufacturing orientation, and high-performance application fit.</p>\n<h2>Why South Korea is relevant</h2>\n<p>South Korea's industrial profile makes it a meaningful market for thermal management, advanced materials, and engineering-led supplier evaluation.</p>\n<h2>How to evaluate suppliers in this market</h2>\n<ul><li>Check manufacturing or technology positioning</li><li>Review whether the supplier serves battery, electronics, industrial, or insulation markets</li><li>Look for export readiness and documentation availability</li></ul>\n<h2>FAQ</h2>\n<h3>Why might buyers target South Korea aerogel suppliers?</h3><p>Because the country has strong capabilities in advanced manufacturing and technology-intensive materials sectors.</p>\n<h3>What matters most in supplier screening?</h3><p>Technical fit, manufacturing credibility, and whether the supplier's market focus matches the intended application.</p>\n<h3>Are South Korean suppliers mostly relevant for battery-related topics?</h3><p>Not only that. They may also be relevant in industrial insulation and broader advanced-materials contexts.</p>\n<h2>Related resources on Aerogela</h2>\n<ul>\n  <li><a href=\"https://aerogela.com/listing-category/aerogel-producers/\">Aerogel Producers</a></li>\n  <li><a href=\"https://aerogela.com/listing-category/distributors/\">Aerogel Distributors</a></li>\n  <li><a href=\"https://aerogela.com/what-is-aerogel-insulation/\">What Is Aerogel Insulation?</a></li>\n  <li><a href=\"https://aerogela.com/how-to-choose-aerogel-suppliers/\">How to Choose Aerogel Suppliers</a></li>\n  <li><a href=\"https://aerogela.com/blog/\">Aerogela Blog</a></li>\n</ul>",
  "excerpt": "",
  "hero": "/heroes/south-korea-aerogel-suppliers"
}
