{
  "slug": "thin-insulation-building-retrofit-aerogel",
  "title": "Thin Insulation for Building Retrofit: Where Aerogel Can Outperform Bulkier Materials",
  "date": "Fri, 17 Apr 2026 08:41:31 +0000",
  "content": "<p>Building retrofit projects often face a basic conflict: improve thermal performance without sacrificing too much interior space or disrupting existing architectural constraints. This is exactly why <em>thin insulation building retrofit</em> has become an important search topic—and why aerogel-based insulation products are regularly part of the conversation.</p>\n<h2>Why retrofit projects are different</h2>\n<p>In new construction, designers may have more freedom to allocate wall thickness. In retrofit work, especially in dense urban buildings or historically sensitive structures, space is limited. Even small increases in insulation thickness can affect window details, room dimensions, service penetrations, or facade geometry.</p>\n<h2>Where aerogel fits</h2>\n<p>Aerogel is attractive in retrofit contexts because it is associated with strong thermal performance in thin sections. That makes it relevant for wall upgrades, specialty interior insulation layers, facade details, and other locations where conventional bulkier insulation may be difficult to use.</p>\n<h2>What project teams should compare</h2>\n<ul><li>Required thermal performance versus available thickness</li><li>Moisture management and building-physics implications</li><li>Fire, code, and assembly requirements</li><li>Installation complexity and labor considerations</li><li>Total value of preserved usable space</li></ul>\n<h2>Why this topic matters for SEO</h2>\n<p>People searching this topic are often not casual readers. They are architects, specifiers, retrofit consultants, and product researchers looking for a solution to a specific design constraint. That makes aerogel retrofit content especially useful for attracting high-intent organic traffic.</p>\n<p>Readers who want to explore relevant materials suppliers can continue through Aerogela’s <a href=\"https://aerogela.com/listing-category/aerogel-producers/\">producer listings</a> and broader <a href=\"https://aerogela.com/blog/\">blog archive</a>.</p>\n<h2>FAQ</h2>\n<h3>Why is aerogel relevant in retrofit projects?</h3><p>Because retrofit work often has strict thickness constraints and aerogel can provide strong insulation performance in thin sections.</p>\n<h3>Is aerogel a universal replacement for standard building insulation?</h3><p>No. It is most compelling when space preservation is a major part of the project value.</p>\n<h3>Who typically searches this topic?</h3><p>Architects, specifiers, retrofit consultants, and buyers evaluating thin high-performance insulation options.</p>\n<h2>Related resources on Aerogela</h2>\n<ul>\n  <li><a href=\"https://aerogela.com/what-is-aerogel-insulation/\">What Is Aerogel Insulation?</a></li>\n  <li><a href=\"https://aerogela.com/how-to-choose-aerogel-suppliers/\">How to Choose Aerogel Suppliers</a></li>\n  <li><a href=\"https://aerogela.com/aerogel-blanket-applications/\">Aerogel Blanket Applications</a></li>\n  <li><a href=\"https://aerogela.com/listing-category/aerogel-producers/\">Aerogel Producers Directory</a></li>\n  <li><a href=\"https://aerogela.com/listing-category/distributors/\">Aerogel Distributors Directory</a></li>\n</ul>",
  "excerpt": "",
  "hero": ""
}