{
  "slug": "asia-aerogel-manufacturers-suppliers",
  "title": "Asia Aerogel Manufacturers and Suppliers: A Regional Guide for B2B Materials Research",
  "date": "Fri, 17 Apr 2026 10:35:17 +0000",
  "content": "<p>Asia is one of the most important regions for aerogel manufacturing, industrial materials scale-up, and export-oriented supply. Buyers searching <em>Asia aerogel manufacturers</em> often want to understand the regional map before drilling into individual countries such as China, Japan, or South Korea.</p>\n<h2>Why a regional view is useful</h2>\n<p>Different Asian markets play different roles. Some are stronger in scale manufacturing, some in specialty materials, and some in distribution or advanced manufacturing integration. Understanding that structure helps buyers research suppliers more efficiently.</p>\n<h2>How to use a regional approach</h2>\n<ul><li>Start with broad regional supplier discovery</li><li>Then narrow by country, application focus, and supplier type</li><li>Separate direct producers from distributors and technical intermediaries</li></ul>\n<h2>FAQ</h2>\n<h3>Why start with an Asia-wide aerogel search?</h3><p>Because the region contains multiple important supply markets and a regional view helps buyers refine country-level research more effectively.</p>\n<h3>Is one Asian country dominant in all aerogel segments?</h3><p>No. Different countries may lead in scale, specialization, or application-specific strength.</p>\n<h3>How should buyers narrow the field?</h3><p>By country, product format, application fit, and evidence of real supplier capability.</p>\n<h2>Related resources on Aerogela</h2>\n<ul>\n  <li><a href=\"https://aerogela.com/listing-category/aerogel-producers/\">Aerogel Producers</a></li>\n  <li><a href=\"https://aerogela.com/listing-category/distributors/\">Aerogel Distributors</a></li>\n  <li><a href=\"https://aerogela.com/what-is-aerogel-insulation/\">What Is Aerogel Insulation?</a></li>\n  <li><a href=\"https://aerogela.com/how-to-choose-aerogel-suppliers/\">How to Choose Aerogel Suppliers</a></li>\n  <li><a href=\"https://aerogela.com/blog/\">Aerogela Blog</a></li>\n</ul>",
  "excerpt": "",
  "hero": ""
}